36106/assignment/AT2/data/all_experiments_test_leaderboard.csv

model,accuracy,balanced_accuracy,macro_f1,weighted_f1
CalibratedStacking_exp4,0.9,0.8208968100347411,0.8464472393635116,0.898777626854941
HistGradientBoosting_exp2,0.902667,0.817669,0.84502,0.901012
Stacking_exp3,0.9,0.8278005819385129,0.844879095381037,0.8991517205644608
RandomForest_exp1,0.8853333333333333,0.7971048843462637,0.826197340459698,0.8839077259602265
LogisticRegression_balanced,0.724,0.695263,0.61351,0.743139

README.md

b.	Experiment -1 Random Forest Model Assessment
●	Designed to capture non-linear relationships between clinical features and nutritional defi-ciencies using a bagging ensemble. It utilised Standard Scaler for Biomarkers and One Hot Encoding for symptoms to ensure the forest could effectively partition the mixed type of fea-ture space. 
●	A standard Logistic Regression was bypassed for this experiment due to the non-linear de-pendencies and high dimensional feature interaction identified through EDA. Logistic re-gression assumes a linear relationship between independent and log-odds of target how-ever the clinical data showed that biomarkers like Vitamin C interact non-linearly with specif-ic symptom indicators. Random Forest chosen as the superior starting point because of its recursive portioning mechanism capturing these interactions without requiring manual, high-order polynomial feature engineering and reducing the risk of high bias (underfitting) inher-ent in the linear models.
●	Results: Accuracy: 0.885, Balanced Accuracy: 0.797, Macro F1: 0.826, Weighted F1: 0.884
●	Jump in performance from baseline confirms that clinical biomarkers contain significant predictive signal. The Gap between Global Accuracy and Balanced Accuracy suggesting that the model still face challenges in isolating the minority classes (Scurvy/Night Blindness) from majority health group likely due to Feature Overlap.
●	Optimal Hyperparameters: n_estimators:100, max_depth: None, min_sample_split: 2
●	Feature Selection: All 24 input features were retained allowing Gini importance mecha-nism to internally weight the features during the tree building process.

c.	Experiment -2 Histogram Gradient Boosting Model Assessment
●	Deployed a gradient boosting framework for large scale datasets and it utilises the histo-gram-based binning to accelerate the training process to reduce the memory overhead while still maintaining high precision. Workflow focuses on tuning the learning dynamics specifically the learning rate and maximum iterations ensuring the model minimizes the log-loss of the previous weak learners.
●	Hypothesis and Selection Rationale: The gradient boosting can correct residual errors that the bagging approach of experiment 1 Random forest failed to resolve. Unlike Random for-ests which is building parallel trees, Hist Gradient Boosting builds it sequentially focusing on instances hard to classify. Approach selected to achieve higher peak discrimination by fine tuning decision boundaries in the high-density regions of the biomarkers feature space where “Healthy” and “Anaemic” classes often overlap.
●	Results: Accuracy: 0.902, Balanced Accuracy: 0.818, Macro F1: 0.845, Weighted F1: 0.901
●	The outcome confirms the hypothesis with Experiment 2 achieving top tier performance with F1 (0.8450) compared to experiment 1 suggesting the model learned to distinguish the re-sidual patterns in minority classes that were missed previously.
●	Optimal-Hyperparameters: learning-rate:0.1, max_iter:100, min_depth: None, l2_regularisation:0.0
●	Feature Selection: All available features utilized and algorithm’s internal binning and gradient based importance were leveraged to prioritize the most discriminative biomarkers.
●	Quantify the improvements achieved and the potential value generated.

d.	Experiment -3 Stacking Ensemble Model Assessment
●	Stacking Methodology: Developed Stacked Ensemble Architecture to fuse the predic-tive capabilities of distinct model families. The methodology combined Random Forest (bag-ging), Hist Gradient Boosting(boosting) and Logistic Regression(linear) as base learners. First level of the prediction was fed into Logistic Regression meta learner which was trained to optimally weigh output of the model and make the final clinical classification.
●	Hypothesis and Selection Rationale: The central hypothesis is that ensemble diver-sity adds incremental value to reduce the correlated errors and combining models with dif-ferent mathematical (tree-based vs linear) stacking approach aimed to mitigate the com-plementary model families and improves the robustness in the high overlap regions of the feature space where the single model’s architecture might plateau.
●	Results: Accuracy: 0.9000, Balanced Accuracy: 0.8278, Macro F1: 0.8449, Weighted F1: 0.8992
●	The results were highly competitive however compared to Experiment 2 the gains in Macro F1 were marginal. The outcome suggests the model is nearing the architectural saturation where increasing complexity of ensemble no longer yields significant predictive returns.
●	Optimal-Hyperparameters: Base learners: (RF, HGB,LR), Meta-learner: Logistic Re-gression (C=1.0)
●	Feature Selection:  The meta learner utilized the probability distributions like soft-voting signals from the base models rather than getting it form the raw 24 biomarkers.

e.	Experiment -4 Stacking Ensemble Model Assessment
●	Calibrated Stacking Methodology: The final configuration utilises the stacked En-semble architecture from the Experiment 3 with strategic addition of Probability Calibration layer. This involves Sigmoid Calibration (Platt Scaling) to ensemble the raw output scores. Post processing ensures that predicted probability distribution aligns with the true empirical frequency of clinical classes in dataset.
●	Hypothesis and Selection Rationale: This experiment was selected to ensure the model predicts an 85% probability of a deficiency that diagnoses is correct 85 percent of time as in a clinical setting the model cannot be merely accurate its confidence score must be statistically honest. Reliability allows the clinicians to set precise and threshold-based in-terventions. Making the system viable governance tool rather than just a black box predic-tor.
●	Results: Accuracy: 0.9000, Balanced Accuracy: 0.8209, Macro F1: 0.8464, Weighted F1: 0.8988
●	Experiment 4 is the Champion Model achieving the Macro F1 Score of 0.8464 across all the experiments and having global accuracy of 90%, this configuration offers most precise balance of Precision and recall for both majority and minority groups. By en-semble the diversity with calibrated probabilistic output and providing the robust and trust-worthy performance for high stakes clinical triage.
●	Optimal-Hyperparameters: CV: 5-Fold, Calibration Method: Sigmoid, Final Estimator: Logistic Regression (C=1.0).
●	Performance Metrics Framework: Primary focus on Macro F1, balanced Accuracy. These metrics makes it the Champion Model for protecting the High Minority patients (Scur-vy/Night Blindness) while maintaining diagnostic efficiency for broader population.